Course,Institution,Professors,Platform,Status,Score,Honor
"Algorithms: Design and Analysis, Part 1",Stanford University,Tim Roughgarden,Coursera,Completed,100.0%,<a href="/files/algo1.pdf">SoA</a>
"Algorithms: Design and Analysis, Part 2",Stanford University,Tim Roughgarden,Coursera,Completed,93.4%,<a href="/files/algo2.pdf">SoA</a>
"Machine Learning", Stanford University, Andrew Ng, Coursera, Completed, 100.0%, <a href="/files/ml_ng.pdf">SoA</a>
"Statistical Inference", Johns Hopkins University, Brian Caffo, Coursera, Completed, 100.0%, <a href="/files/statinference.pdf">SoA</a>
"Introduction to Linear Models and Matrix Algebra", HarvardX, Rafael A. Irizarry, EdX, Completed, 100.0%, <a href="/files/lmma.pdf">SoA</a>
